animalInternalID,animalAID,name,litterGroupID,species,breed,age,animalDoB,sex,color,arrivalDate,status,sizeGroup,currentWeightPounds,altered,adoptionFeeGroupID,websiteMemo,lastIntakeDate,lastProfileUpdate,currentLocationTier1,currentLocationTier2,currentLocationTier3,currentLocationTier4,currentLocationTier5,behaviorCategory,kennelNumber,volunteerColor
78486985,128260.0,Scooby,,Dog,Mixed Breed (Medium),32,2021-06-30,Male,Brown,2023-11-02,Available (Shelter),Medium (20-59),48.0,True,199281.0,"-Potty Trained
-Loose leash walker 
-Affectionate
-Quick learner
-CUTEST ZOOMIES EVER!",2023-11-02,2024-03-05 21:52:07,Dog,TLAC,Building 2,,,PG5 (OMuzzle),179,Yellow - CIN
7800784,62273.0,Grizelda,,Dog,"Retriever, Black Labrador/Mix",72,2018-02-07,Female,Black/None,2023-11-21,Available (Shelter),Medium (20-59),47.0,True,17723.0,"Grizelda loves hard and what she loves the most is playing... and being a couch potato. 

This sweet, affectionate girl loves to run, go on walks, and play fetch. Then when she's tuckered out, she wants to be a couch potato. If you are on the couch with her, she'll want to curl up in a ball next to you. She is a very active dog who wants at least one walk a day. She's so fascinated by all those other critters she sees -- deer, dogs, cats, squirrels, lizards, bugs, etc. This super smart girl answers to many requests, such as ""sit,"" ""lay down,"" ""roll over,"" and ""go to bed."" She'll even answer to ""play dead,"" laying down until told to get up. Talk with a Matchmaker about this special lady today!
",2023-11-21,2024-02-25 10:38:14,Dog,TLAC,Building 3,,,[BMOD-offleash],214,Silver
60547548,113145.0,Sand Dune,,Dog,"Terrier, Pit Bull",33,2021-05-27,Male,Tan/White,2023-02-21,Available (Shelter),Medium (20-59),50.0,True,17723.0,"Surfs up! Say hello to Sand Dune. He parties hard and works harder. He is named after his toasty coat that reminds one of relaxing beach days. 

Sand Dune may look like any other cute doggie but he's a hardworking man looking for employment! He has a good work ethic and is ready to fetch all the tennis balls. In addition to being a punctual employee, Sand Dune also knows: sit, shake, down, place, stay, here. Additionally, he is crate trained and house trained. He does well on the leash as well.

This confident, outgoing boi knows how to let loose after the work day is done. In his foster home he enjoyed walking, jogging, and chewing. The generally active guy is also a team player and loves making human friends. He also has some doggie friends here at APA!

Sand Dune is looking for an active family where he can be the only pup and keep sharpening his skills. Ready to employ your new best friend? Talk to a matchmaker today. 
",2023-02-21,2024-02-24 17:51:40,Dog,TLAC,Building 2,,,PG3 (D),201,Yellow - CIN
78525917,128281.0,Sabrina,,Dog,Mixed Breed (Medium),39,2020-11-04,Female,Tan/White,2023-11-04,Available (Shelter),Medium (20-59),51.6,True,199281.0,"What an adorable pup! This is Sabrina, a scared little girl who is looking for a family to call her own. Sabrina is shy and needs time and space to warm up to people. This 3-year-old beauty does not like the noisy shelter and is looking for a loving home. She gets along great with other dogs and likes to play!",2023-11-04,2024-03-01 23:16:03,Dog,TLAC,Building 1,,,EPG4,136,Red
1349599,41281.0,Honey Bun,,Dog,"Cattle Dog, Australian (Blue Heeler)/Mix",118,2014-04-29,Female,White/None,2023-07-11,Available (Shelter),Medium (20-59),51.8,True,14274.0,"Honey Bun is a senior lady with just the right amount of puppy energy sprinkled in. Age hasn't slowed her down; she loves to be active. She loves playing tug and chasing a frisbee. She loves cozying up for pets or butt scratches. But she's not needy and can easily entertain herself. She has no problem being left home alone for a full work day, and does just fine free roaming the house. She's a well-mannered housemate and never gets into things she shouldn't.

She can be nervous with new people and situations, shying away from a crowd. But with those she knows well, she is a confident goofball who always entertains with her playful antics. She loves to play, chase her toys around the yard and show off her skills. She would love a patient adopter who can be her advocate, allowing her time and space to interact when she is truly ready. She would love to be the only pet, but could potentially live with a well-matched dog friend. ",2023-07-11,2024-02-29 18:33:51,Dog,TLAC,Building 1,,,[BMOD-offleash],135,Silver
45287397,100995.0,Hamilton,,Dog,"Wolfhound, Irish/Mix",136,2012-10-02,Male,Grey/Tan,2023-03-16,Available (Shelter),Large (60-99),68.0,True,14274.0,"Hamilton is eleven-years young and looking for a couch he can really sink into. A fan of fetch, tug, and long walks where he can sniff to his heart's content, Hamilton also loves a good movie night. 

He's been there and done that, so he knows how to behave in the home, and his previous foster reports he can be left alone on free roam successfully for at least 6 hours.

This beautiful guy would love to go home with people that can respect his thoughts about where and when he likes to be touched but once he knows you, he wants all the pets and love. 

Can you give Hamilton a home? Ask about him today!",2023-03-16,2024-02-26 13:01:40,Dog,TLAC,Building 2,,,EPG3 (D-CD),209,Yellow
77419494,127721.0,Obsidian,,Dog,"Retriever, Labrador",42,2020-08-11,Male,,2023-10-11,Available (Shelter),Medium (20-59),48.4,True,199281.0,"Obsidian is a stone of clarity, with the ability to release emotional, physical, blockages, drawing out stress and tension. Just like this silly guy! HE is fun! HE is silly! He is outgoing! While he may be a little nervous at first, once he gets to know you, he will love you forever!",2023-10-11,2024-02-26 13:10:07,Dog,TLAC,Building 1,,,PG5 (Transition - CD - OMuzz),132,Silver - CIN
16427495,76765.0,Indie,,Dog,"Collie, Border/Basenji",62,2018-12-13,Male,Chocolate/White,2019-10-02,Healthy In Home,Medium (20-59),40.0,True,,,2019-10-02,2019-10-27 16:15:10,,,,,,EPG2 (PUPPY),37,Pink 
74835430,125921.0,Elvie,,Dog,"Terrier, Pit Bull",35,2021-03-09,Male,Black/White,2023-08-15,Available (Shelter),Medium (20-59),52.0,True,199281.0,"This smart, athletic boy is mastering the agility course to prepare for the big day. Got a doggo at home? Great! Elvie is looking for a friend to romp around with. Elvie does prefer a home with older teens though. Are you ready to wrap this baby in love? He is super stressed out being at the shelter and needs to go to a home ASAP. Grab the treats and the toys and take Elvie home.",2023-08-15,2024-03-05 01:13:26,Dog,TLAC,Building 3,,,PG3,260,Red - CIN
77754341,127891.0,Lambert,,Dog,"Terrier, American Pit Bull",80,2017-06-23,Male,Blue,2023-10-20,Available (Shelter),Large (60-99),63.0,True,199281.0,"Lambert is potty-trained and knows basic commands. He is good on his own when left alone. But he will love to cuddle when you get home. Lambert is a special guy who would like all of your attention, so maybe a house where he can be the only dog in your life. He's not a fan of cats and would prefer to be introduced to new dog friends slowly. Lambert is a snuggle muffin, so come on by and check out his cuddles. ",2023-10-20,2024-03-06 00:33:21,Dog,TLAC,Building 3,,,[DEACTIVATED-MED],247,Silver - CIN
16760318,77058.0,Watson,,Dog,"Great Dane/Retriever, Labrador",61,2019-01-01,Male,Tan/White,2019-10-15,Healthy In Home,Large (60-99),65.0,True,,,2019-10-15,2019-10-27 20:52:04,,,,,,EPG3 (PUPPY),169,Silver
14314477,74435.0,Sir Wigglesworth,,Dog,"Terrier, Pit Bull/Mix",83,2017-03-10,Male,Brown/Tan,2019-07-09,Healthy In Home,Large (60-99),62.0,True,,"Sir Wigglesworth is in APA!'s Total Obedience Program (TOP), which is modeled after the AKC's Canine Good Citizen (CGC) test.  As a TOP dog, he has a personalized training plan and works with a volunteer trainer several times a week to help him learn skills like walking nicely on leash, sitting calmly when approached by strangers or other dogs, staying in a sit or down until told ""free,"" coming when called and ""place"", which means he will go to a specific place in your home on command.

Sir Wigglesworth is working hard to become a wonderful companion, and as a part of APA's Total Obedience Program you can work with APA staff to continue to build a training relationship with him after adoption and master all the TOP dog skills together.  Check out a video on APA's CGC program, on which TOP was based: https://vimeo.com/89434193 
",2019-07-09,2019-10-31 08:08:29,,,,,,PG5b(muzzle),264,Red
37187054,93958.0,Biggs,,Dog,Dogo Argentino,95,2016-03-16,Male,White/Black,2023-05-03,Available (Shelter),Large (60-99),82.3,True,14274.0,"Hello there, I'm Biggs! I'm a seasoned fellow with a heart full of sweetness. Independence is my forte, but I'm always up for a friendly pat or a fun game. My smarts are unparalleled, and loyalty is my middle name. I am deaf but I understand hand signs and know commands. I am a goofball and love a good laugh. People say that I am a gentle giant. Oh, and I adore treats! Life's been an adventure, and I'm ready for my next chapter. I promise to bring joy, laughter, and steadfast companionship to your life. Wanna come over to APA! and meet? I'd love a comfy home and foster friend to go home with. ",2023-05-03,2024-03-01 18:33:59,Dog,TLAC,Building 4/5,,,PLAYDATE (Muzzle),25,Silver
29180400,90097.0,Cherry Pie,,Dog,"Terrier, Pit Bull/Mix",75,2017-11-10,Female,Tan/White,2023-03-05,Available (Shelter),Medium (20-59),56.0,True,17723.0,"Introducing Cherry Pie, a sweet, house-trained cute little lady. She walks well on a leash and is always up for adventures whether it's a hike in one of Austin's many amazing trails or even just fun playtime in the backyard. 

She is crate-trained so you can trust she will be content when you are away at work or running errands. She considers her crate her little room all to herself and doesn't mind spending time in there as long as you make it a cozy warm place for her to nap. 

Cherry Pie would prefer to be the only pet in the home so all the love and cuddles you can give go all to her. She will return all the cuddles that come her way! Ask about this precious lady today!",2023-03-05,2024-03-04 17:27:36,Dog,TLAC,Building 2,,,[BMOD-threshold],193,Silver - CIN
76590075,127154.0,Frisco,,Dog,"Retriever, Labrador",9,2023-05-06,Male,Brown/White,2023-09-13,Available (Shelter),Medium (20-59),48.0,True,199281.0,"
Meet Frisco, the embodiment of puppy exuberance and canine camaraderie! This tan and brown dynamo exudes an enthusiastic puppy-like energy, especially when engaging with other dogs. Frisco is a true dog lover, reveling in playful interactions. While he may still be refining his doggy manners, his interactions with a patient and non-dominant resident dog showcase his adaptability and sociable nature.

Frisco is making strides in his potty training journey, demonstrating a growing understanding of indoor etiquette. However, he may experience some separation anxiety, emphasizing the importance of patient guidance and reassuring companionship. With the right blend of love, patience, and positive reinforcement, Frisco promises to blossom into a wonderful and joyful addition to any dog-loving home. If you're ready to welcome a lively and affectionate companion, Frisco is eager to fill your days with tail wags and puppy antics! Inquire more today!",2023-09-13,2024-03-02 05:20:46,Dog,TLAC,Building 3,,,PG3 (Puppy),231,Blue
41806332,97693.0,Bluebelle,,Dog,"Shepherd, Australian/Mix",92,2016-06-10,Female,Black/White,2021-06-26,Available (Shelter),Large (60-99),65.8,True,14274.0,"Two things people in Austin proudly love: Blue Bell ice cream and keeping it weird. Spelled differently but just as sweet, Bluebelle would make a great addition to your love list. 
""Bluebelle has my favorite personality on campus. She's playful and smart and so affectionate,"" says one of her friends. She loves to stop and smell the roses, and a sniffari is her idea of a wonderful outing. You've got a new co-pilot if you adopt Bluebelle. She'll happily jump in and out of your car to accompany you on an adventure. Don't be embarrassed if you find yourself using a baby voice with animals, because Bluebelle likes it! Bluebelle is ready for a photo-snapping pet parent, and she even has her own Instagram! Fall in love with her @adopt_beautiful_bluebelle and then come meet her in person. 
",2021-06-26,2024-03-05 21:31:38,Dog,TLAC,Building 4/5,,,PG5,28,Red
69284350,120821.0,Jot,69284612.0,Dog,"Chinese Shar-Pei/Retriever, Labrador",13,2023-01-29,Male,Black/White,2023-08-29,Available (Shelter),Medium (20-59),57.64,True,199281.0,"Puppy love in a full grown body! At 10 months old, Jot is like a gangly teenager-all legs and learning and kind of a dufus about it all. 

Jot loves snacks and has been learning such lovely manners while in the shelter. His leash skills improve daily and would make a great exercise buddy. 

Adventure awaits for Jot! He'd love a family with teenagers and another full grown dog who can help him learn better teenage manners. A young dog with such potential, Jot is ready to go home-stop by our Town Lake facility to meet him today!",2023-08-29,2024-03-04 14:03:35,Dog,TLAC,Building 2,,,PG5 (Puppy),185,Yellow
