animalInternalID,animalAID,name,litterGroupID,species,breed,age,animalDoB,sex,color,arrivalDate,status,sizeGroup,currentWeightPounds,altered,adoptionFeeGroupID,websiteMemo,lastIntakeDate,lastProfileUpdate,currentLocationTier1,currentLocationTier2,currentLocationTier3,currentLocationTier4,currentLocationTier5,behaviorCategory,kennelNumber,volunteerColor
16966659,77413.0,Chianti,,Dog,"Terrier, Pit Bull/Mix",64,2018-10-24,Male,Brown/Tan,2019-10-30,Healthy In Home,Medium (20-59),40.0,True,,,2019-10-30,2021-09-24 11:00:39,,,,,,EPG2(D),225,Blue
82852875,130010.0,Colette,,Dog,"Pointer/Pyrenees, Great",34,2021-04-05,Female,White/Black,2024-01-17,Available (Shelter),Medium (20-59),52.0,True,199281.0,"- sweet cuddle bug
- potty/house trained
- good with dogs
- needs low traffic home",2024-01-17,2024-02-29 20:30:11,Dog,TLAC,Building 1,,,PG4 (CD),114,Silver
76825614,127401.0,Piccolo,,Dog,"Retriever, Chocolate Labrador/Mix",9,2023-05-28,Male,Brown/None,2023-09-29,Available (Shelter),Medium (20-59),35.6,True,199281.0,"Meet Piccolo, the charming cuddle buddy ready to wiggle his way into your heart! Currently in foster care, Piccolo has been fostering positive interactions with other dogs including the resident dog. He has also met various dogs on walks, and his interactions have been consistently positive.

Piccolo's daily routine includes playful energy bursts, followed by cozy naps, with a penchant for finding sunny spots to snooze. Despite his petite size, his snores are impressive when he sleeps on his back. Piccolo is a sweetheart who loves to check in with nose-boops and is eager to continue improving his leash skills through training.

If you're looking for a loving companion who enjoys both playtime and snuggles, Piccolo is the perfect match. Come meet him today and experience the joy he brings firsthand! ",2023-09-29,2024-03-05 23:51:32,Dog,TLAC,Building 4/5,,,[REASSESS],18,Pink 
52003345,113457.0,Augustus,,Dog,"Bulldog, American",70,2018-03-30,Male,White/None,2022-09-28,Available (Shelter),Large (60-99),77.0,True,17723.0,"Meet Augustus, a sweet and curious dog with a knack for problem-solving. Being deaf, Augustus's intelligence shines through his ability to understand sign language, a testament to his adaptability and resilience. He's quick to pick up new commands, and his curious spirit means he's always up for exploring new environments or learning new tricks. Augustus's unique blend of sweetness, curiosity, and smarts make him a delightful companion. Adopting Augustus means welcoming a loving, intelligent, and resilient friend into your life. His understanding of sign language opens up a whole new way of communicating and bonding with a pet. Give Augustus a chance, and he will show you the depth of loyalty and love a new friend can offer! Talk with a Matchmaker today about meeting Augustus!",2022-09-28,2024-02-24 13:54:40,Dog,TLAC,Building 1,,,[BMOD-offleash],109,Blue
11038744,70688.0,Rascal,11038744.0,Dog,Shepherd/Mix,62,2018-12-22,Male,Brown/White,2022-10-19,Available (Shelter),Medium (20-59),50.0,True,17723.0,"A whole lot of learnin' to do!

For Rascal, the world seems to be a pretty overwhelming place. Rascal is nervous about new sounds, the chaos of the shelter and meeting new folks. Luckily, he has a team of staff and volunteers who help him gain confidence every day!

Rascal arrived at APA! has a tiny puppy without proper socialization. Luckily he found himself a home where he was accepted for who he was, though things changed and Rascal ended up back at the shelter.

While in the shelter, volunteers and staff discovered that Rascal can be his best self when he's in a yard with other dogs. He can take learning cues from other dogs and discovered that petting and human attention doesn't have to be scary. Each day Rascal gains confidence and trust and we see the glimmer of who he actually is!

While it will take time to see the true Rascal, we know that he's crate and house trained and will likely do well living in a home with other dogs, though the transition period may be a little rough.

Rascal comes with the full support of skilled staff who know the ins and outs of training and managing his unique personality. Are you ready to see the true Rascal? Take a chance and click the 'adopt me' button or consider fostering!",2022-10-19,2024-02-28 23:34:21,Dog,TLAC,Building 4/5,,,PG4 (D-CD),57,Red
25692699,85897.0,Bindi,,Dog,"Hound, Plott/Mix",46,2020-04-06,Female,Brindle/None,2023-06-06,Available (Shelter),Large (60-99),70.4,True,199281.0,"""Crikey Mate!"" While Bindi may not be from down under, this brindle beauty is still sure to be an exciting companion. When Bindi's not chatting up her mates in playgroup or flexing her muscles fetching tennis balls, she's expressing her passions as a foodie - gobbling down any treats thrown her way! Bindi is sitting patiently at the shelter for her new home. She's looking to be spoiled as your one and only, in exchange she's happy to hold down the house with polite manners while you're out. 

Ready to meet your new best friend? Click the blue button or come in to ask a matchmaker about Bindi today!",2023-06-06,2024-02-29 20:19:35,Dog,TLAC,Building 4/5,,,PG5 (Muzzle),38,Silver - CIN
25517083,85642.0,Fudge,,Dog,Rottweiler,50,2019-12-13,Male,Black/Brown,2024-02-16,Available (Shelter),Medium (20-59),55.0,True,199281.0,,2024-02-16,2024-03-01 10:41:20,Dog,TLAC,Building 1,,,PG4,152,Yellow
1338396,37585.0,Rousseau,,Dog,"Coonhound, Bluetick/Mix",97,2016-01-11,Female,Brindle/None,2023-01-13,Available (Shelter),Large (60-99),63.0,True,17533.0,"Rousseau is the sweetest, most loving,  and loyal senior dog you can find. She is the biggest cuddle bug and is totally content to spend all afternoon lying around or watching TV. Rousseau is incredibly smart & loves working for her treats. She already knows several commands like down, sit, and shake.

She would really love a home where her people are home often - she just gets lonely. Rousseau also asks to be the only pet in the home - she wants all the attention for herself! Anyone who helps this lady will have an incredible companion for the rest of their life. Come meet this lovable lady! ",2023-01-13,2024-03-02 22:43:00,Dog,TLAC,Building 2,,,[BMOD-threshold],173,Silver
63446051,115720.0,Klaus,,Dog,"Pyrenees, Great/Shepherd, German",23,2022-03-08,Male,White/None,2023-06-21,Available (Shelter),Large (60-99),94.0,True,199281.0,"Santa Klaus is coming to town! He's making a list and checking it twice to find out if you'll be his new adopter! Klaus is an intelligent boi who knows the commands: sit, down, up, stay, crate, beso. Santa Klaus checked the nice list and you are on it! He loves his people as well as scritches, especially between the eyes, and playing with toys. Interested in celebrating Christmas year round in your home? Klaus would do best with a low traffic home; Klaus has potential to live with children 13+ as well as well matched dog friends. Want to meet the famous December 25th hero? Talk to a matchmaker today!",2023-06-21,2024-02-24 18:51:11,Dog,TLAC,Building 4/5,,,EPG5 (Med),22,Yellow - CIN
77003814,127452.0,Jace,,Dog,"Bulldog, American/Mix",12,2023-02-27,Male,Black/White,2023-09-30,Unavailable - Behavior (Shelter),Medium (20-59),58.0,True,199281.0,"At only 11 months old, this pup has already been through a lot. He came to the shelter in October with an infectious smile and a big heart. Sadly, since his arrival, Jace has started to regress. He hates being cooped up in a kennel and is scared of all the loud noises at the shelter. Jace desperately needs to find a foster who can show him love and affection and get him out of here.

Jace still has that puppy energy so he would do best with someone who can handle his jumpy excitement and teach him how to be a good boy. He is learning to walk well on a leash. Jace loves going on walks and doggy playgroup. He honestly loves anything that gets him out of his kennel. Can you help Jace and show him that the world doesn't have to be such a scary place?",2023-09-30,2024-03-04 21:28:11,Dog,TLAC,Building 1,,,PG4 (Muzzle-Puppy),102,Red
50045485,104486.0,Edna,,Dog,"Terrier, Pit Bull/Mix",43,2020-07-24,Female,Blue/White,2022-05-21,Available (Shelter),Large (60-99),64.0,True,17723.0,"Edna: Gentle Giant + sweet soul. Edna loves wading in the water, playing fetch, and going for car rides
. 
Edna is also the perfect hiking partner! Her friends took her to McKinney Falls where she showed off her leash skills and her go with the flow attitude. 

Edna is GREAT with kiddos and would love to have them to dote over her. Bonus points if her humans are home more than they're away. Edna would be happy to part of the carpool! 

""Edna is a sweetheart that will make a great companion to a family who can give her all the attention she deserves. She also loves teenagers!"" -Stephanie, former foster

Edna quickly learns basic commands like sit and shake, and loves to add new tricks to her repertoire! To meet this smart and sweet gal, talk to a matchmaker today!",2022-05-21,2024-03-02 23:13:07,Dog,TLAC,Building 4/5,,,PG5 (CPR-OMuzz),19,Purple
16856627,77258.0,Poppy Seed,,Dog,Cattle Dog/Mix,65,2018-09-18,Female,Brown/Tan,2019-10-22,Healthy In Home,Medium (20-59),39.0,True,,,2019-10-22,2019-11-01 13:20:48,,,,,,EPG3,03,Blue
16112692,76654.0,Sploot,,Dog,"Retriever, Labrador/Mixed Breed (Large)",81,2017-05-14,Male,Red/Mahogany/None,2019-09-27,Healthy In Home,Large (60-99),73.0,True,,,2019-09-27,2019-10-27 13:09:27,,,,,,EPG3,06,Blue
67636280,118718.0,Chapo,,Dog,"Shepherd, German/Mix",84,2017-02-25,Male,Black/Brown,2023-02-21,Available (Shelter),Large (60-99),64.8,True,17723.0,"Chapo: a slow burn - love earned. Chapo is extremely sweet and affectionate once he gets to know you. He's super cute on walks and looks back at his human and 'checks in' with them to make sure they are okay. How considerate! After long walks he loves to relax on the couch and watch a good movie with his humans. He knows short word commands such as sit, go, and stay. Chapo is a play group rockstar here at APA! and has lots of doggie friends. And as a fun last touch, he loves pizza! Ask the Matchmakers about a meet and greet today!",2023-02-21,2024-02-24 13:56:51,Dog,TLAC,Building 1,,,PG3 (D-Med),140,Silver
10163261,69863.0,Po,10163175.0,Dog,Hound/Mix,61,2019-01-17,Male,White/Black,2019-10-14,Healthy In Home,Medium (20-59),55.0,True,,,2019-10-14,2019-10-23 17:25:44,,,,,,EPG2 (PUPPY),199,Blue
50297407,104788.0,Azriel,50297493.0,Dog,Weimaraner/Mix,27,2021-11-09,Male,Silver/None,2023-10-08,Available (Shelter),Medium (20-59),52.4,True,199281.0," Meet Azriel, a delightful 2-year-old male Weimaraner/Mix with a heart as big as his playful spirit. Azriel is a charming blend of curiosity and affection, always ready to explore the world with his bright, soulful eyes and wagging tail. This handsome boy loves to romp and play, making him the perfect companion for an active family or individual seeking adventure and companionship. He's eager to learn and is ready to steal your heart with his endearing personality and unwavering loyalty. 

Azriel's ideal new home will be one with a yard, active parent(s) who like playing with him, and no children. He would love to have a dog brother or sister to play with! Come meet this adorable boy!",2023-10-08,2024-03-04 18:27:23,Dog,TLAC,Building 3,,,EPG4 (D),218,Silver
69968449,130139.0,Splitz,69968360.0,Dog,Shepherd,13,2023-01-11,Male,Brown/None,2024-01-20,Available (Shelter),Medium (20-59),30.2,True,199281.0,At first glance you may not notice Splitz has any faults. He is so great and social with other dogs that it is hard to believe his character differs in the presence of humans. Abandoned at only three months in the shelter with two siblings. It has taken a lot of patience to overcome his fear of people. We are not sure of his past but we do know he needs love. Splitz is a work in progress that would greatly benefit getting out of the shelter. Ask about him today!,2024-01-20,2024-03-06 00:24:23,Dog,TLAC,Building 2,,,EPG2,197,Yellow
84009026,130816.0,Halftime Show,84009026.0,Dog,Shepherd/Mix,48,2020-02-12,Female,Tan/White,2024-02-11,Available (Shelter),Medium (20-59),39.2,False,199283.0,,2024-02-11,2024-02-27 02:13:02,Dog,TLAC,Building 1,,,EPG3,112,Blue
24597573,88471.0,Isabelle,24597665.0,Dog,"Terrier, Pit Bull",67,2018-07-22,Female,White/Brown,2022-12-08,Available (Shelter),Medium (20-59),57.0,True,17723.0,"Meet Isabelle, a delightful white and tan companion ready to fill your home with love! Isabelle is an independent spirit who thrives when given the space to be herself. She excels in house training, making her an excellent addition to any household.

Isabelle is a charming solo act, making her the perfect fit for a home where she can bask in all the doggy attention. While she's learning to navigate the complexities of anxiety, her resilient spirit shines through as she bravely copes and adapts. Isabelle's endearing personality and eagerness to connect make her an ideal furry friend for someone seeking a devoted canine companion. If you're ready to provide a loving and patient environment, Isabelle is prepared to be the shining star in your heart and home! Inquire today!",2022-12-08,2024-03-03 00:17:01,Dog,TLAC,Building 2,,,PG5 (Muzzle),175,Silver
16751688,77028.0,Jetta,,Dog,"Shepherd, German/Husky, Siberian",65,2018-09-14,Female,Black/Tan,2019-10-22,Healthy In Home,Medium (20-59),45.0,True,,,2019-10-22,2019-11-06 13:56:43,,,,,,EPG1,224,Pink 
56332361,110154.0,Jingle,,Dog,"Terrier, American Pit Bull",69,2018-05-24,Female,Black/White,2022-12-31,Available (Shelter),Medium (20-59),41.25,True,17723.0,"What's that sound you hear? No, it's not a sleigh pulled by reindeer, it's Jingle!

""Jingle is a cuddle bug and loves a good head rub, said Jingle's former foster. ""She also likes to tip over head first in my lap and stick her butt in the air for some nice butt scratches!

- Jingle's favorite pastime is digging for treats in her snuffle mat. She's never turned down a kong filled with frozen peanut butter either!
- After playing fetch and wading in her doggy pool, Jingle loves to snuggle up with her person on the couch.
- This pup's at the top of her class, knowing sit and lie down. She'd love for you to teach her more tricks!

If she sounds like your type of gal, Jingle all the way to APA to meet her today!",2022-12-31,2024-03-05 22:46:11,Dog,TLAC,Building 4/5,,,PG5 (OMuzzle),06,Silver - CIN
72178761,123801.0,Mama,72178761.0,Dog,Mixed Breed (Medium),44,2020-06-06,Female,Brown/White,2023-06-11,Available (Shelter),Large (60-99),66.2,True,199281.0,"Mama
Mama is a very obedient girl. On sleepovers she is discovering that people can actually be kind, loving, and safe. She was mistreated in her past. Mama was nervous when first going on leash walks. Walking with another dog helped her gain confidence and she now is a great walking companion. She is a smart lady who understands many basic commands, including ""stay"" ""sit"" and ""down."" She does well when left alone, gated in her own little area. She is a playgroup rockstar and has many doggie friends here at APA!",2023-06-11,2024-02-26 19:12:39,Dog,TLAC,Building 1,,,EPG3,118,Yellow
61858892,114271.0,Nubs,,Dog,"Shepherd, Australian/Retriever, Golden",86,2016-12-23,Male,Tan/White,2022-10-22,Available (Shelter),Medium (20-59),57.4,True,14274.0,"Say hello to Nubs! If Nubs had a love language, it would most certainly be physical touch! He's a real lovebug that can never get enough pets and loves giving kisses! Nubs has been described as goofy, easy-going, and affectionate. There's not a box this boy can't check! He would do especially well in a calmer, low traffic home with older, more mature kids. 


~ 6-year-old  golden retriever/australian shepherd mix - Playgroup rockstar! 

~ SUPER affectionate and sweet (very cuddly)!

~ House-trained and does well when left alone

~ likes fetch, tug of war, and chasing squeaky toys

 ~ knows sit, stay, down, come and shake!

ASK ABOUT NUBS TODAY!",2022-10-22,2024-02-24 14:59:57,Dog,TLAC,Building 2,,,PG3 (CD),177,Silver
74162254,125393.0,Neo,,Dog,"Husky, Siberian/Retriever, Labrador",31,2021-07-08,Male,Tan/White,2023-08-01,Available (Shelter),Medium (20-59),67.0,True,199281.0,"Hello my name is Neo, it is nice to meet you. I haven't been feeling myself because I am stressed out and having a hard time eating in the shelter environment. I am fearful of strangers so I need a patient friend who will respect my boundaries and love me as I am. Once I get to know you, I am loving and playful. I love baby talk, yummy treats, and patient people. I am also a play group rockstar and do great with all my doggie friends here at APA! Please talk to a matchmaker today if you want to be my friend.",2023-08-01,2024-03-04 19:12:49,Dog,TLAC,Building 2,,,EPG5,183,Silver - CIN
66649680,117832.0,Pelota,,Dog,Terrier/Boxer,27,2021-11-17,Male,Black/White,2023-02-06,Available (Shelter),Medium (20-59),53.0,True,17723.0,"Hey ya'll! My name is Pelota and I'm looking for a person who loves long walks and snuggles, I love meeting new people. I am super food motivated and love to learn new tricks. I have a great loose leash walk and know some basic obedience already! Will you be my favorite human and give me all the belly rubs and snacks?",2023-02-06,2024-03-05 01:52:28,Dog,TLAC,Building 2,,,[BMOD-threshold],187,Silver - CIN
2469482,54076.0,Campbell,2469482.0,Dog,Mixed Breed (Medium),78,2017-08-22,Female,Brown/Black,2023-11-27,Available (Shelter),Medium (20-59),38.5,True,199281.0,"Campell loves to be brushed and work for yummy treats. She also enjoys fetch, running around, and naps once she is all worn out! Can you take Campbell home and be her new playmate?",2023-11-27,2024-03-04 02:25:32,Dog,TLAC,Building 1,,,EPG2,108,Yellow
83841644,130730.0,Smoochi Roo,,Dog,Chow Chow,46,2020-04-10,Male,Black,2024-02-07,Available (Shelter),Medium (20-59),38.0,True,199281.0,"- very shy and very sweet
- holds it to potty outside
- learning how to trust and how to dog very quickly ",2024-02-07,2024-03-05 22:10:13,Dog,TLAC,Building 2,,,EPG5,195,Yellow
57445494,111376.0,Widget,,Dog,"Collie, Border/Mixed Breed (Medium)",46,2020-04-26,Male,Black/White,2022-11-29,Available (Shelter),Medium (20-59),58.6,True,16268.0,"Meet Widget - a silly boy who's sure to steal your heart! Widget is a goofy, energetic pup who loves to learn. He knows basic commands, and is house-trained. He loves to play! He's looking for his very own forever family who loves long walks and swimming as much as he does, and who will give him lots of pets! Come by today to meet this affectionate, water loving guy!",2022-11-29,2024-02-24 16:54:27,Dog,TLAC,Building 2,,,PG3,165,Silver - CIN
16856696,77259.0,Skips,,Dog,"Terrier, American Pit Bull",76,2017-10-01,Female,White/Black,2019-10-22,Healthy In Home,Medium (20-59),49.0,True,,,2019-10-22,2019-11-02 13:14:52,,,,,,EPG3,45,Blue
47605373,102972.0,Big Dawg,,Dog,Shepherd,27,2021-10-30,Female,Brown/Black,2023-09-27,Available (Shelter),Medium (20-59),51.0,True,17723.0,Big Dawg has a huge heart and is very affectionate! She adores her humans and always wants to play with both people and other dawgs. She is an active girl who loves outside time and has been really enjoying playgroup here at APA! Come ask about this sweetheart so she can become part of your family!,2023-09-27,2024-02-24 18:37:46,Dog,TLAC,Building 3,,,EPG3 (Med),265,Silver - CIN
1653894,48431.0,Carley,,Dog,"Terrier, Pit Bull/Mix",99,2015-11-06,Female,Brown/None,2019-10-21,Healthy In Home,Medium (20-59),50.0,True,,"Carley is a mellow lady, but that doesn't mean she doesn't want attention from her human friends. Give her some petting and her eyes light up, tail all a'wag!

This beautiful girl is forming a fan club. Carley has been invited out to coffee by one of her closest human friends at the shelter, and they have discovered she's a traffic-stopper! When she goes for a walk down a busy Austin street, people stop to admire her and compliment her looks. Carley was very polite to her adoring fans, letting them pet her and rejoice in her go-to attire: a tutu. 

Carley assists to our daily playgroup, so going home with a canine sibling is a possibility. Older children that understand boundaries are sure to win her over. She also seems to be house trained.  This beauty is the complete package!

Come meet this stunner; she'll be proud to let you show her off around town!",2019-10-21,2019-10-26 17:57:28,,,,,,EPG3,183,Orange
1428114,45339.0,Mycah,,Dog,"Retriever, Black Labrador",88,2016-10-15,Male,Black/White,2023-04-18,Available (Shelter),Large (60-99),89.8,True,14274.0,"My guy: Mycah. He's the tall, dark, and handsome boi of your dreams.  Mycah is ready for a new bestie and a new crib. Mycah is TOP Dog trained so he is basically a genius but he specializes in kisses and snuggles! He is a dreamboat who loves exercise and is ready to be your next running partner. He'll even throw his ears back for maximum aerodynamics! The only thing Mycah doesn't understand is that he is not lap sized because he sees himself as a lapdog. 
Mycah has the potential to live with well matched dog friends but would do best in an adult only home. Look into his eyes and you'll see that Mycah is full of love and playfulness. Talk to a matchmaker today to meet this dreamy man!
",2023-04-18,2024-03-04 19:02:50,Dog,TLAC,Building 4/5,,,PG5 (Transition - OMuzz),23,Silver - CIN
83344018,130402.0,Ruston,83343596.0,Dog,Mixed Breed (Medium),5,2023-09-11,Male,Black/White,2024-01-28,Available (Shelter),Medium (20-59),23.0,False,199283.0,,2024-01-28,2024-03-04 00:24:59,Dog,TLAC,Building 3,,,EPG2 (Puppy),263,Pink 
16936092,77367.0,Archibald,,Dog,Carolina Dog/Mix,113,2014-09-25,Male,Red/Mahogany/None,2019-10-28,Healthy In Home,Medium (20-59),48.0,True,,"Archibald enjoys learning new things and is in APA!'s Total Obedience Program (TOP), which is modeled after the AKC's Canine Good Citizen (CGC) test.  As a TOP dog, he has a personalized training plan and works with a volunteer trainer several times a week to help him learn skills like walking nicely on leash, sitting calmly when approached by strangers or other dogs, staying in a sit or down until told ""free,"" coming when called and ""place,"" which means he will go to a specific place in your home on command.

As part of APA's Total Obedience Program you can work with APA staff to continue to build a training relationship with Archibald after adoption and master all the TOP dog skills together.  Check out a video on APA's CGC program, on which the TOP was based: https://vimeo.com/89434193 
",2019-10-28,2021-10-07 13:29:38,,,,,,PG5a,37,Silver
82851487,130009.0,Froggy,,Dog,"Terrier, Pit Bull",49,2020-01-17,Male,Grey/White,2024-01-18,Available (Shelter),Medium (20-59),59.0,True,199281.0,,2024-01-18,2024-03-01 20:27:10,Dog,TLAC,Building 4/5,,,PG5 (Muzzle),10,Silver
71015586,122897.0,Spinach,,Dog,"Pyrenees, Great",11,2023-03-19,Male,White/None,2023-11-29,Available (Shelter),Large (60-99),60.0,True,199281.0,"Meet Spinach, a charming and playful pup with a unique feature - he has only one eye! But don't let that fool you, as he is full of energy and loves to play tug of war and chase flies in the great outdoors. His goofiness is sure to keep you entertained, especially when he tries to clumsily jump on the couch or shows his excitement through hilarious facial expressions. 

Spinach is a well-trained dog, he is house-trained and has mastered the ""sit"" command. He responds well to positive reinforcement and is highly motivated by food... aren't we all? 

However, Spinach needs to live in a household with adults and kids old enough to respect his space when he is eating and understand that he doesn't like to share his things. But don't let that discourage you, as he is a loyal and loving companion who will make an amazing buddy on walks and romps around the backyard. ",2023-11-29,2024-02-28 21:52:09,Dog,TLAC,Building 4/5,,,PG4 (Puppy),17,Yellow
9935014,69440.0,Clef,9572599.0,Dog,Cattle Dog,61,2019-01-11,Male,Brindle/None,2020-05-10,Available (Foster),Medium (20-59),76.4,True,17723.0,"This Clef is so much more than a musical symbol. He has skills, smarts and the best ears in town.

This fun-loving pup has a ton of training under his belt and loves to learn a new trick.  ""Clef is a big love bug and just wants to play with his person,"" says one of his pals Ashley. ""He is incredibly smart, treat motivated and loves to learn new tricks!"" This genius knows to sit, lie down, stay, get the ball and when it's time to 'play'! Plus, he is eager to learn more commands. Clef's favorite snack is peanut butter and he can be happily occupied by a fun puzzle toy stuffed with this tasty treat. 

He is also always happy to give his brain a rest and hang out with his favorite people. He is currently in foster and loves his foster dad who is his best friend. He waits politely while his foster gets his work done for the day and then knows it is time to hang. He loves a good game of tug or fetch and then time to relax. Clef knows the basic rules of being the best boy in a home. He is also always happy to meet a new person when friends come over to his foster home. 

If you think Clef could be your sidekick, tutor, workout buddy, good looking sidekick, cuddle buddy, couch warmer, cooking partner or anything else that is better with a friend, come meet Clef! He would love to find his forever buddy.",2020-05-10,2024-03-05 23:45:55,,,,,,PG5 (OMuzzle),131,Silver - CIN
