animalInternalID,animalAID,name,litterGroupID,species,breed,age,animalDoB,sex,color,arrivalDate,status,sizeGroup,currentWeightPounds,altered,adoptionFeeGroupID,websiteMemo,lastIntakeDate,lastProfileUpdate,currentLocationTier1,currentLocationTier2,currentLocationTier3,currentLocationTier4,currentLocationTier5,behaviorCategory,kennelNumber,volunteerColor
62814515,115155.0,Frosty the Snowman,,Dog,"Bulldog, English",21,2022-05-17,Male,Brown/White,2023-09-22,Available (Shelter),Large (60-99),61.0,True,199281.0,This wiggle butt wants nothing more than to be by your side. He loves people and loves butt scratches. His little snarfle sounds let you know he loves you. He is the sweetest boy that is sure to entertain you no matter what! He would love to meet you and show you how much love he has to give. ,2023-09-22,2024-03-02 06:51:50,Dog,TLAC,Building 1,,,EPG3 (Med),120,Pink 
43753780,100043.0,Marsala,,Dog,Boxer/Mix,42,2020-08-15,Female,Tan/Black,2022-07-08,Available (Shelter),Medium (20-59),54.4,True,17723.0,"Marsala is a party girl looking for her forever home! Nothing makes this gal happier than pleasing her people and playing a rousing round of fetch. ""Marsala loves playing outside, especially rolling around on the grass when she's tired!"" said an APA volunteer. Marsala loves being outside and getting her exercise, but is just as happy to be inside being a couch potato. This good girl is a TOP Dog trainee, which means she's working on 10 real-world skills to be a better canine citizen! She is a big puppy who loves to run around, but she also does well when left alone in her crate for some rest and relaxation. Check out Marsala's videos and come meet this snuggly girl today!",2022-07-08,2024-02-24 19:22:51,Dog,TLAC,Building 4/5,,,EPG5 (CD-OMuzzle),48,Silver - CIN
7707955,62002.0,Wade,,Dog,"Terrier, Pit Bull/Mix",79,2017-07-05,Male,Blue/White,2023-12-30,Available (Shelter),Medium (20-59),70.0,True,199281.0,"Meet Wade, an all-around delightful companion ready to bring happiness to your home! This handsome pup is not just potty trained but also understands commands like sit and stay, responding eagerly when called by his original name, Jax.

Wade has a charming personality, displaying friendliness and happiness when meeting new people. He loves to run up for a friendly sniff and is quick to place his head on your leg, seeking affection and pets. Wade is a social and food-motivated pup, making every interaction a joy.

This lovable fellow enjoys spending time in his crate and freely roams the house, displaying a sense of independence. While he may be better suited as the only dog in the household, Wade's adaptability shines as he can be left alone for extended periods, happily occupying his time.

Whether he's playing with toys, enjoying snoozes, or sneaking onto the bed for a nap, Wade is a versatile and loving companion. If you're seeking an indoor dog who can also be your outdoor buddy for hikes or runs, Wade is the perfect match. Come meet Wade today and discover the joy he brings to every moment! Inquire today!",2023-12-30,2024-03-04 21:29:03,Dog,TLAC,Building 2,,,PG5,189,Silver
81907510,129707.0,Presley,,Dog,"Retriever, Labrador/Mix",13,2023-01-09,Female,Brown,2024-01-10,Available (Shelter),Medium (20-59),30.0,True,199281.0,,2024-01-10,2024-03-05 21:41:49,Dog,TLAC,Building 2,,,EPG3,207,Blue
69275959,120806.0,Gilligan,,Dog,"Terrier, Pit Bull",46,2020-04-13,Male,White/Brown,2023-04-06,Available (Shelter),Large (60-99),63.0,True,199281.0,"He needs a little time to get to know you but once he does you're in for lots of loving! Gilligan is a very handsome AND smart guy. He's potty-trained and knows a variety of commands like SIT, SHAKE, HEEL, and is more than capable of learning more! Plus who can resist those LOVELY mismatched ears??",2023-04-06,2024-02-24 18:09:05,Dog,TLAC,Building 3,,,PG5 (Transition),241,Yellow
77223739,127612.0,Falling Leaves,,Dog,"Terrier, Pit Bull",28,2021-10-06,Female,Grey/White,2023-10-06,Available (Shelter),Medium (20-59),42.0,True,16268.0,"Meet Falling Leaves! A young gal with a boundless curiosity and sharp intellect. She is looking for her forever family! This sweet girl is more than just a pet, she's a companion, a friend, and a source of joy. She deserves a loving home where she can continue to grow, learn, and spread happiness. Adopt Falling Leaves and gain a loyal friend who will always be there to brighten your day! Talk with a Matchmaker about meeting her today!
",2023-10-06,2024-03-05 00:04:55,Dog,TLAC,Building 1,,,EPG3 (Med),113,Blue
9570116,66854.0,Leopold,,Dog,"Shepherd, German",134,2012-12-23,Male,Black/Tan,2019-05-28,Healthy In Home,Large (60-99),49.5,True,,"Leopold is a very good boy who loves being outside, but he also likes to spend a lot of time being next to his people being loved on.  Leopold is a big fan of pets and belly rubs and will happily roll over, hoping you'll give him some.  

This majestic guy always has the best poses.  He's a beautiful, regal, classic German Shepherd who will sit stoically until you pull out a toy, and then he's ready to play! Overall, Leopold is a pretty chill guy, but he'll get hyped up when he knows it's playtime.  He'll bounce about swinging his toys around, and he's absolutely thrilled if you'll play catch or fetch with him.  

Leopold is deaf, but he's an excellent student and already knows sit, shake, down and responds well to no.  He does all this with hand signals and is learning all kinds of new skills in APA!'s Total Obedience Program (TOP), which is modeled after the AKC's Canine Good Citizen (CGC) test.  

As a TOP dog, Leopold has a personalized training plan and works with a volunteer trainer several times a week to help him learn the skills to become the best dog he can be! He is learning skills like walking nicely on leash, sitting calmly when approached by strangers or other dogs, staying in a sit or down until told ""free,"" coming when called and ""place"", which means he will go to a specific place in your home on command.

Once Leopold successfully completes all the skills on his training plan, he will be considered TOP Dog Ready! Leopold is working hard to become a wonderful companion, and as a part of APA's Total Obedience Program you can work with APA staff to continue to build a training relationship with him after adoption and master all the TOP dog skills together.  Check out a video on APA's CGC program, on which the TOP was based: https://vimeo.com/89434193

Come meet this sweet boy!",2019-05-28,2019-11-04 12:09:04,,,,,,[REASSESS],09,Purple
74199885,125451.0,Saucey Sauce,,Dog,Catahoula Leopard Dog/Husky,11,2023-03-02,Female,Black/White,2024-02-06,Available (Shelter),Medium (20-59),33.0,True,199281.0,"Need something to zest up your day? How about a little Saucey Sauce? This little pup is ready to get out of the scary shelter. She is very shut down and shy, and she would love a cozy and safe home to give her some sweet relief! She would prefer a home with adults only, but would be a lovely fit for a home with the patience to give her the time she needs. Talk to a matchmaker today to help this sweet gal decompress.",2024-02-06,2024-02-24 19:26:45,Dog,TLAC,Building 4/5,,,[BMOD-offleash],54,Silver - CIN
30852436,90948.0,Elle,,Dog,Boxer/Mix,70,2018-04-23,Female,Black/None,2020-12-08,Available (Shelter),Large (60-99),66.8,True,17723.0,"If you are looking for the perfect blend of adventure buddy + couch potato, pretty Elle is the pup for you! She knows to be respectful of your things, and does fine when left crated or free roaming. Elle has plenty of energy for walks, runs and romps around the yard, or adventures with her people. She loves to play tug and fetch. When she's not playing or sniffing around, Elle LOVES learning new things (for treats of course)! A very smart girl, she understands ""sit,"" ""down"" and ""shake,"" and is working on ""speak"" and ""quiet."" 

Elle does well walking on leash, and she's a #fitgirl who will help you reach your steps goals while she sniffs all the smells and takes in the scenery. Her previous foster said she was a great running buddy. Elle is also eager to check in with her person for snacks and pets. She comes out to playgroup regularly to socialize with well-matched dogs. We believe Elle might do well living with a confident pup after proper introductions.

Elle is very affectionate with her friends and seeks their love by putting her head under their hands. She's a professional cuddler, as she knows there's no size limit for lap dogs. Are you looking for someone to rest her head in your lap while you watch Netflix? Elle is your girl! Click the blue button to ask about this sweet lady today! And get more Elle content on instagram @elle_of_apa",2020-12-08,2024-03-04 21:25:03,Dog,TLAC,Building 1,,,[BMOD-threshold],110,Yellow - CIN
66176344,117418.0,Peabody,,Dog,"Terrier, Pit Bull",43,2020-07-16,Male,Tan/None,2023-01-24,Available (Shelter),Medium (20-59),53.5,True,17723.0,"If Peabody asks to see your ID, don't be surprised. This handsome guy may be shy at first, but before you know it, he'll be your best friend!  Peabody loves car rides, long walks, cuddling up on the couch, and has even made friends with cats!

Peabody does well in his crate, but loves cuddling up in your bed as well. Peabody will love a home with patient and experienced parents who can continue his training. He establishes trust quickly, and will become your very best friend! Come meet this adorable cuddle bug!",2023-01-24,2024-03-05 22:43:02,Dog,TLAC,Building 3,,,[BMOD-threshold],212,Yellow
75344728,126192.0,Chester,,Dog,"Husky, Siberian/Mix",30,2021-08-22,Male,White/Grey,2023-11-18,Unavailable - Behavior (Shelter),Medium (20-59),42.5,True,16268.0,"- Highly intelligent
- Appears Potty Trained
- LOVES Fetch!
- Plays with Toys by Himself <3
- Treat Motivated
- Leans in for Love and Cuddles",2023-11-18,2024-03-05 22:41:32,Dog,TLAC,Building 2,,,PG5 (Muzzle),41,Purple - CIN
38177115,95001.0,Hei Hei,38176735.0,Dog,"Cattle Dog, Australian (Blue Heeler)/Mix",36,2021-02-22,Male,Black/Tan,2023-03-11,Available (Shelter),Medium (20-59),38.4,True,17723.0,"If you are hoping to find a tennis playmate, hey, Hei Hei can be your partner! This very active boy loves playing with tennis balls. He's always even trying to fit two tennis balls in his mouth. 

Hei Hei also loves playing in sprinklers, chewing toys and playing fetch. He's great at fetch. He also loves going on walks, pulling a bit on his leash at the beginning and end. He pays no attention to most other dogs he sees. 

At home, he always follows his people around. If they are sitting or laying on the furniture, he curls up with them to cuddle. 

He's a very smart boy who understands sit, down and place. He can just be stubborn sometimes, not convinced he needs to obey. He's okay at meeting strangers outside his home. He's just a protective boy who's suspicious of new people who come to the house. 

Hei Hei will love to move in with an active person who has training experience. Come meet this beautiful boy. Offer him an ID and he'll decide you're trustworthy. He'll want to cuddle with you! ",2023-03-11,2024-02-27 11:08:18,Dog,TLAC,Building 4/5,,,EPG3,47,Yellow
16801638,77136.0,Sherman,,Dog,"Retriever, Labrador/Mix",76,2017-10-06,Male,Brown/White,2019-10-18,Healthy In Home,Large (60-99),68.0,True,,,2019-10-18,2019-10-25 10:59:00,,,,,,EPG2,28,Orange
43243378,98841.0,Cash,,Dog,Pointer/Mix,90,2016-07-30,Male,White/Brown,2021-07-30,Available (Shelter),Large (60-99),61.6,True,14274.0,"Cash came from Dallas, TX back in 2021 and has been in our care ever since. We'd love to see this sweetheart in a home as he's been in shelter long enough.

Cash is the kind of house guest you'd love to have - respectful, well-behaved, and always up for cuddle time. He's crate-trained but also great free-roaming! He's got a heart as big as his love for toys, and he knows how to keep you company whether you're working from home, binge-watching Netflix, or you're just snoozing on the couch. 

Cash is looking for a family who understands that love and patience can work wonders. A cozy spot by the window for sunbathing, a basket full of toys, and a heart full of love - that's all Cash needs to feel at home. Ask a matchmaker about him today! 

Check him out on Instagram @adopt_cash",2021-07-30,2024-02-29 17:47:58,Dog,TLAC,Building 1,,,EPG2 (D),126,Silver
48625026,103300.0,Roses,47556247.0,Dog,"Cattle Dog/Retriever, Labrador",26,2021-12-18,Female,White/Brown,2024-01-09,Available (Shelter),Medium (20-59),47.0,True,199281.0,"Staff and volunteers have fallen in love with this girl! If they had to choose one word to describe her, it would easily be ""sweet"". She's been truly an absolute sweetheart! She recently went on a sleepover with some humans and they said she was great! She enjoyed chew toys, was calm in the car to and from the shelter, and is very potty trained! Come by the Cesar Chavez location to meet this sweet lady today!",2024-01-09,2024-03-04 21:29:36,Dog,TLAC,Building 2,,,EPG3,199,Yellow
73580421,124923.0,Lucky Star,,Dog,Mixed Breed (Medium),37,2021-01-18,Male,Black/Brown,2023-07-14,Available (Shelter),Large (60-99),59.0,True,199281.0,"It's your Lucky Day to meet Lucky Star! Lucky is a sweet 2 year old mix who loves people and other dogs. He is even a playgroup rockstar here at APA! He is a little shy when meeting strangers but quickly warms up and wants to be your best friend! Lucky has a hard time with all the noise and stress of the shelter and would love if you could provide him with the quiet, loving home that he deserves. Come meet him and find your new companion today! Talk to a matchmaker today!",2023-07-14,2024-03-05 22:41:20,Dog,TLAC,Building 3,,,PLAYDATE,229,Yellow - CIN
59203465,112263.0,Cheddar Cheese,,Dog,"Retriever, Labrador/Mix",66,2018-08-26,Male,White/Black,2024-01-25,Available (Shelter),Large (60-99),84.0,True,17723.0,"Meet Cheddar Cheese, a dog with a beautiful black and white coat who loves to play and snuggle. This friendly Lab mix is great at making people happy with his sweet nature and happy face. Even when he's home alone, he does just fine. But what he loves most is cuddling up and getting pets from his favorite humans.

Cheddar is a star when it comes to playing with other dogs and is always ready for fun and games. If you like spending time outside and want a cuddly friend, Cheddar Cheese might be the perfect buddy for you. Come talk to us to meet this lovely boy and see how much joy he can bring to your home!",2024-01-25,2024-03-04 22:09:03,Dog,TLAC,Building 4/5,,,EPG3,35,Yellow
72110988,123727.0,Pumbaa,,Dog,"Shepherd, Anatolian/Shepherd, German",58,2019-04-23,Male,Tan/Black,2023-06-10,Available (Shelter),Large (60-99),66.0,True,16268.0,"Pumbaa is a silly little man that loves to play outside. He enjoys ear scratches and lounging around his hoomans. His previous family consisted of 3 adults and 6 children of various ages. They noted that he is a good loyal dog and knows how to protect his pack. He lived in an apartment/condo situation that had access to a yard. He's been known to avoid other dogs and cats inside the home. From his previous notes, observation with his previous family and foster, we believe he has potential to be properly introduced to and eventually live with children, other mellow and calm pets.

Our shy man prefers a calm environment and doesn't like sudden and loud changes around him. He has crate experience in his previous home. Pumbaa loves playing with squeaky toys (lamb chops) and trading sits for treats. He was used to 3 walks a day and is considered a medium energy dog. He is a playgroup rockstar here at APA! and has doggie pals. Talk to a matchmaker today to meet this polite gentleman. 

",2023-06-10,2024-02-24 16:07:14,Dog,TLAC,Building 1,,,EPG3 (D),111,Pink 
66653584,117833.0,Mellie Mel,,Dog,"Terrier, Pit Bull/Mix",60,2019-02-26,Female,Brown/Brindle,2023-01-30,Available (Shelter),Large (60-99),63.6,True,17723.0,"Dear Diary, 

Today I have been thinking a lot about toys and treats. The humans keep saying that I am ""treat motivated lol @ humans - what dog isn't? For real. What dog isn't because I would love to take those treats off their hands?

I've also been thinking about how much fun I had at the Greenbelt with my volunteer friend - so many treats - so many smells. Is that what Paris is like? I would really like more green belt time and more treats. Did I mention treats before?

I've also been dreaming about my forever home. I want to be the only dog for sure; I am the main character after all. I also want my crate there. I like my crate; especially when there are treats inside. I was also thinking about how I would be a great roommate and then I could have my own jar of treats. 

PS: I hope they have toys.
PSS: and treats.

Mellie Mel 
",2023-01-30,2024-02-24 18:28:07,Dog,TLAC,Building 3,,,PG5 (Muzzle),254,Silver
69221270,120744.0,Tamagotchi,,Dog,"Catahoula Leopard Dog/Hound, Basset",58,2019-04-06,Male,Brindle/Brown,2023-04-10,Available (Shelter),Large (60-99),62.0,True,199281.0,"Are you nostalgic for your childhood? 
Well Tamagotchi, may not be the same size as the one from your childhood, but he needs to be fed and loved all the same. 

He broke free from his pixilated jail cell and into the 3 dimensional world, now he just needs outta the shelter! Tamagotchi is sweet, and playful! He loves his toy time and could play for hours and hours! He has the most fun in the agility yard and is incredibly smart! 

Come and ask the Matchmakers for more info! ",2023-04-10,2024-03-04 13:51:28,Dog,TLAC,Building 4/5,,,PG5 (CD-Muzzle),59,Red - CIN
36790167,93370.0,Delta,,Dog,Pointer/Mix,71,2018-03-04,Female,White/Red/Mahogany,2022-02-03,Available (Shelter),Large (60-99),57.4,True,17723.0,"Delta is a sensitive and sweet soul with tons of affection to share. More than anything, she loves being with her people. And people who work from home are her favorite! She'll snore away next to you as your emotional support coworker or settle in her crate if your colleagues prefer to hear just your voice on a Zoom call!   She can be a little wary of new people at first, but when she is ready for love, she doesn't hold back! 

She loves (yes, loves) to be outside, splashing in kiddie pools, running in the yard, or sunning on the patio. Delta is up being your polite co-pilot, with her ears flapping out the window to grab a cappuccino.  And while a quiet walk will make her happy, she is always up for lounging with her loved ones.  She's your go-to cuddle buddy, ready to snuggle up and listen to your every word.

Delta would prefer to be the only pet in your home so she can soak up all of the love. But she is open to a very well-matched dog sibling.  She has so much personality and loves sharing it with friends! Nothing would make her happier than to have a forever family. Consider opening your heart to Delta - she'll bring endless joy to your life. Follow her @princess.bellyrubs",2022-02-03,2024-02-25 11:39:44,Dog,TLAC,Building 4/5,,,EPG3 (CD),46,Yellow - CIN
76248479,126932.0,Carmen,,Dog,"Retriever, Black Labrador/Retriever, Golden",29,2021-09-13,Female,Black/None,2023-09-13,Available (Shelter),Medium (20-59),54.8,True,199281.0,"Carmen came to APA! with severe fractures after being hit by a car but is on the mend! A shelter is no place to live after she's been given a second chance at life. She can be shy at first but after being bribed with some cheese or hot dogs, you can easily win her over! A quote from a recent sleepover host: "" I would say her personality is lovable, kind, sweetheart, snuggly and silly"". Come meet this sweet girl today!",2023-09-13,2024-03-01 08:45:44,Dog,TLAC,Building 1,,,EPG2 (Med),137,Blue
17382310,78746.0,Bamci,17382310.0,Dog,Black Mouth Cur,63,2018-11-21,Male,Golden/Brindle,2023-05-13,Available (Shelter),Large (60-99),68.8,True,199281.0,"Looking for a new best friend? Bamci is your guy!  Bamci is potty trained, crate trained, and the most respectful and polite house guest. Bamci would make a great running partner, but is also just as happy to hang out and chill with you at home. Bamci has been through our total obedience program, and loves to show off his skills. Give him his forever home, and in return he'll be the most loyal companion you could ask for. ",2023-05-13,2024-02-29 20:39:05,Dog,TLAC,Building 3,,,PG3 (CD-OMuzzle),256,Silver
80485809,128937.0,Lars,,Dog,"Shepherd, Australian/Corgi, Pembroke Welsh",52,2019-10-09,Male,Blue/White,2023-12-06,Available (Shelter),Medium (20-59),42.0,True,199281.0,"Lars is a good boy! He is potty-trained, gets along well with other pups who are calm, and is an A+ cuddler. This beautiful cattle dog boy is way too handsome to be a shelter dog. He is mature but still has that young pup energy. He would be a great running buddy. Lars would do best in a home with adults who can handle his good looks and energy. 
",2023-12-06,2024-02-24 16:41:37,Dog,TLAC,Building 1,,,PG4 (CD),141,Red
37700020,94545.0,Nectarine,,Dog,"Terrier, Pit Bull",61,2019-02-01,Female,Brown/White,2021-12-18,Available (Shelter),Medium (20-59),49.0,True,17723.0,"Sweet Nectarine can be a bit suspicious when meeting new people and may ask for your ID. But very soon she'll want to be near you all the time, and she'll love to cuddle with you. Once she knows you, she's a wonderful cuddler who always wants to sleep right next to her people. 

Her former foster said she is phenomenal and amazing in her crate. When she hears the word ""crate"" she runs to it. And when she sees her dinner being prepared, she goes in and waits for her bowl. And she's happy to hang out there when her foster is away. Nectarine is a smart, house-trained girl who also understands ""sit"" and ""wait"". 

Nectarine will love a quiet home where she can be with her new parents and give them her love and cuddles. And she'll enjoy a doggie playmate. Come meet this beautiful girl. Offer her your ID and for sure, she'll decide to follow you home! ",2021-12-18,2024-03-02 19:00:38,Dog,TLAC,Building 3,,,EPG3,249,Yellow - CIN
8116152,63077.0,Breeze,,Dog,"Terrier, Pit Bull/Mix",90,2016-08-17,Female,Blue/White,2023-01-08,Available (Shelter),Large (60-99),61.0,True,14274.0,"This silly, happy girl's name is Breeze. All she wants is to find a family to love! Could it be with you? She would love to be your hiking buddy, as she's always up for an adventure. 

Breeze also LOVES the water and is down to make a splash! She is an energetic, intelligent gal who appreciates bonding on a walk with her humans. Whether it's a walk around the block or on a greenbelt trail...maybe even near some water?! Afterward, all she wants is to chill and snuggle on the couch by your side. 

Breeze is ready to be your new best friend - come by and ask about her today!",2023-01-08,2024-02-24 17:57:58,Dog,TLAC,Building 3,,,[BMOD-threshold],213,Silver - CIN
1506747,46638.0,Xylo,1506725.0,Dog,Catahoula Leopard Dog/Mix,86,2016-12-15,Male,White/None,2023-06-08,Available (Shelter),Medium (20-59),56.2,True,14274.0,"Yeehaw Brother!!! Welcome Xylo: The Last Southern Gentleman. This dapper fella is crate and house trained. He has those good ole southern manners so of course he has the potential to live with cats and dogs. His southern charm means he excels in cuddles and loving. To keep himself company ready, Xylo loves to be brushed. There is only enough room in this town for one :: Xylo does better with older children so no youngin's for this cowboy. Xylo is searching the south for parents who are home often to give him lots of love and snuggs. Ready to meet the man keeping chivalry alive? Giddy on up and Talk to a matchmaker today.",2023-06-08,2024-03-04 19:03:22,Dog,TLAC,Building 3,,,PG5,237,Yellow
76484540,127070.0,Rez,,Dog,"Shepherd, German",37,2021-01-25,Male,Brown/Black,2023-09-19,Available (Shelter),Large (60-99),73.0,True,16268.0,"Introducing Rez! This handsome, almost 3-year old-year-old German Shepherd is looking for a loving home. He's a loyal companion with a heart full of love and a strong desire to protect and care for his people. Rez is a bundle of energy, always eager to explore the world. If you're interested in this wonderful boy, ask about meeting him today!",2023-09-19,2024-02-29 18:52:19,Dog,TLAC,Building 4/5,,,PG5 (Transition),21,Red - CIN
70298054,122059.0,Pine,,Dog,"Retriever, Labrador/Terrier",15,2022-11-03,Male,White/Black,2023-05-03,Available (Shelter),Medium (20-59),45.4,True,199281.0,"Pine, the resilient heart on a quest for a forever home, is a testament to the transformative power of love and care. In the four months under the dedicated fostering of his human, Pine has blossomed into a spirited and playful companion, leaving behind the shadows of his past.

Every walk with Pine is an exploration of joy, with his curiosity matching the dewy grass under his paws. Despite the cautious glint in his eyes, Pine is a social butterfly with other dogs, showcasing remarkable gentleness with his feline friend, Morgan.

In the cozy confines of his crate, Pine has mastered the art of being a content and patient companion while his humans are away. However, his mischievous side may surface when left to his own devices, a testament to his youthful exuberance.

Living harmoniously with cats, Pine forms a delightful bond with Morgan, engaging in playful activities and sharing naps. His interactions with the feline family member highlight his gentle and adaptable nature.

Pine's foster journey has been one of progress, growth, and overcoming past challenges. If you're ready to offer a patient and understanding home, one that can provide the stability and love Pine needs, consider opening your heart to this resilient pup. Reach out to arrange a visit and experience the joy of Pine's company for yourself!",2023-05-03,2024-03-03 03:10:48,Dog,TLAC,Building 3,,,EPG3 (Puppy),219,Yellow
